Questionnaire,Content,Availability,Respondent
MuKi A (Mutter-Kind-Fragebogen),"Schwangerschaftsverlauf, Entbindung, Vorsorgeuntersuchung, Gesundheit, Kinderbetreuung, Lebensumstand",Ab 2003,Mutter im Haushalt (über Kind zw. 0-1 Jahr) 
MuKi B (Mutter-Kind-Fragebogen),"Persönlichkeit des Kindes, Gesundheit, Kinderbetreuung, Sprache, Entwicklung und Fähigkeiten",Ab 2005,"Mutter oder Vater im Haushalt 
(über Kind zw. 2-3 Jahren)"
MuKi C (Mutter-Kind-Fragebogen),"Persönlichkeit des Kindes, Aktivitäten mit Kindern, Gesundheit, Betreuung",Ab 2008,Mutter im Haushalt (über Kind zw. 5-6 Jahren)
Eltern-Kind- Fragebogen,"Elterliche Erwartungen an schulische Leistungen, Erwartungen und elterliche Erziehungsziele, Erziehung, Evaluation der Elternrolle, Kinderbetreuung",Ab 2010,Eltern im Haushalt (über Kind zw. 7-8 Jahren)
MuKi E (Mutter-Kind-Fragebogen),"Elterliche Erwartungen an schulische Leistungen, Bildung und elterliches Engagement, Freizeitaktivitäten des Kindes, Familiäres Umfeld, Sozialverhalten des Kindes, Persönlichkeit des Kindes, Gesundheit des Kindes
Betreuung, Taschengeld",Ab 2012,Mutter im Haushalt (über Kind zw. 9-10 Jahren)
